{
  "schema": "teechat-openapi-edge-manifest/v1",
  "key_id": "openapi-attestation-v1",
  "published_at": "2026-09-11T06:13:02Z",
  "epoch": 52,
  "not_after": "2027-07-29T02:35:30Z",
  "retired_grace_period_days": 30,
  "manifest_url": "https://github.com/Lightec-AI/teechat-openapi/releases/download/v0.12.10/openapi-edge-attest.json",
  "policy": {
    "reject_debug": true,
    "max_quote_age_ms": 3600000,
    "require_session_spki_bind": true,
    "require_runtime_policy_pin": true
  },
  "regions": [
    {
      "region": "global",
      "hostnames": [
        "openapi.teechat.ai"
      ],
      "active": [
        {
          "build_version": "0.13.3",
          "code_hash": "a7b8266a80848aeeef1c91c3366c314a462a841806fa36a64a8624b1ccbb635d",
          "policy_hash": "7c14218c6abcb3ec5dc1998a1e0ddb0e86c7f96d35a215e29538dc3f273f4c0e",
          "quote_formats": [
            "snp_report"
          ],
          "measurement": {
            "kind": "launch_digest",
            "launch_digest": "47377b56dd9123aefaec8b2c9fef03983c8fffa3b74b8b505f71c02de4000517",
            "image_digest": "3d520d848a0d6d76ae9bec571bc075f894318bc249c3f1083666ab279b97b8cb"
          },
          "notes": "0.13.3 OpenAPI rich quota-gate WARN (remaining/est/branch); OS 853aefc + app-verity R=bca3adc1\u2026. Seal_sync overlap with 0.13.0/0.13.2.",
          "golden_version": "openapi-golden-20260729-853aefc5f849-seal-sync-app-0.13.3"
        },
        {
          "build_version": "0.13.3",
          "code_hash": "a7b8266a80848aeeef1c91c3366c314a462a841806fa36a64a8624b1ccbb635d",
          "policy_hash": "7c14218c6abcb3ec5dc1998a1e0ddb0e86c7f96d35a215e29538dc3f273f4c0e",
          "quote_formats": [
            "snp_report"
          ],
          "measurement": {
            "kind": "launch_digest",
            "launch_digest": "47377b56dd9123aefaec8b2c9fef03983c8fffa3b74b8b505f71c02de4000517",
            "image_digest": "3d520d848a0d6d76ae9bec571bc075f894318bc249c3f1083666ab279b97b8cb"
          },
          "notes": "0.13.3 OpenAPI rich quota-gate WARN (remaining/est/branch); OS 853aefc + app-verity R=bca3adc1\u2026. Seal_sync overlap with 0.13.0/0.13.2.",
          "golden_version": "openapi-golden-20260729-853aefc5f849-seal-sync-app-0.13.3"
        },
        {
          "build_version": "0.13.0",
          "code_hash": "510315292a224d311d1145109d576b67152102dff7c646949ae330ffcc1a4c91",
          "policy_hash": "7c14218c6abcb3ec5dc1998a1e0ddb0e86c7f96d35a215e29538dc3f273f4c0e",
          "quote_formats": [
            "snp_report"
          ],
          "measurement": {
            "kind": "launch_digest",
            "launch_digest": "034742decabbc2632f0ff22df061c21a18309794edf006ed167a4dc2df56d1af",
            "image_digest": "3d520d848a0d6d76ae9bec571bc075f894318bc249c3f1083666ab279b97b8cb"
          },
          "notes": "0.13.0 OpenAPI train; OS 853aefc + app-verity R=779a1bf3\u2026. Seal_sync blue/green.",
          "golden_version": "openapi-golden-20260729-853aefc5f849-seal-sync-app-0.13.0"
        },
        {
          "build_version": "0.13.0",
          "code_hash": "510315292a224d311d1145109d576b67152102dff7c646949ae330ffcc1a4c91",
          "policy_hash": "7c14218c6abcb3ec5dc1998a1e0ddb0e86c7f96d35a215e29538dc3f273f4c0e",
          "quote_formats": [
            "snp_report"
          ],
          "measurement": {
            "kind": "launch_digest",
            "launch_digest": "034742decabbc2632f0ff22df061c21a18309794edf006ed167a4dc2df56d1af",
            "image_digest": "fdc5250b913498736992024fdefa6c5e5d23a98193df216671cd26ce8d371a0d"
          },
          "notes": "0.13.0 with transitional green IMAGE_DIGEST fdc5250b.",
          "golden_version": "openapi-golden-20260729-853aefc5f849-seal-sync-app-0.13.0"
        },
        {
          "build_version": "0.12.9",
          "code_hash": "7ce2506937018ccdc25f72bb3e39812f5a584b23f3e5e67d227a27cea4104401",
          "policy_hash": "7c14218c6abcb3ec5dc1998a1e0ddb0e86c7f96d35a215e29538dc3f273f4c0e",
          "quote_formats": [
            "snp_report"
          ],
          "measurement": {
            "kind": "launch_digest",
            "launch_digest": "9365b3c4a20cf8f0ac58e98d624faedecf62300e6eb07be967f27fbafeebc43d",
            "image_digest": "3d520d848a0d6d76ae9bec571bc075f894318bc249c3f1083666ab279b97b8cb"
          },
          "notes": "0.12.9 OpenAI-only client streams (METER-002 on gateway); OS 853aefc + app-verity R=ba6e8fcf\u2026. Seal_sync blue/green.",
          "golden_version": "openapi-golden-20260729-853aefc5f849-seal-sync-app-0.12.9"
        },
        {
          "build_version": "0.12.9",
          "code_hash": "7ce2506937018ccdc25f72bb3e39812f5a584b23f3e5e67d227a27cea4104401",
          "policy_hash": "7c14218c6abcb3ec5dc1998a1e0ddb0e86c7f96d35a215e29538dc3f273f4c0e",
          "quote_formats": [
            "snp_report"
          ],
          "measurement": {
            "kind": "launch_digest",
            "launch_digest": "9365b3c4a20cf8f0ac58e98d624faedecf62300e6eb07be967f27fbafeebc43d",
            "image_digest": "fdc5250b913498736992024fdefa6c5e5d23a98193df216671cd26ce8d371a0d"
          },
          "notes": "0.12.9 with transitional green IMAGE_DIGEST fdc5250b.",
          "golden_version": "openapi-golden-20260729-853aefc5f849-seal-sync-app-0.12.9"
        },
        {
          "build_version": "0.12.8",
          "code_hash": "eb3cd193ec6b30567b73d775883eb0e2625cbc8ce457cbb120dd82e2c06c773a",
          "policy_hash": "7c14218c6abcb3ec5dc1998a1e0ddb0e86c7f96d35a215e29538dc3f273f4c0e",
          "quote_formats": [
            "snp_report"
          ],
          "measurement": {
            "kind": "launch_digest",
            "launch_digest": "d400767d2d64ae14e81e3861995c394c8d2909dd261e32122d39cb010921114d",
            "image_digest": "3d520d848a0d6d76ae9bec571bc075f894318bc249c3f1083666ab279b97b8cb"
          },
          "notes": "0.12.8 attested-mtls 69d7281 split-trust v3 + legacy import; OS 853aefc + app-verity R=cdd26617. Seal_sync blue/green.",
          "golden_version": "openapi-golden-20260729-853aefc5f849-seal-sync-app-0.12.8"
        },
        {
          "build_version": "0.12.8",
          "code_hash": "eb3cd193ec6b30567b73d775883eb0e2625cbc8ce457cbb120dd82e2c06c773a",
          "policy_hash": "7c14218c6abcb3ec5dc1998a1e0ddb0e86c7f96d35a215e29538dc3f273f4c0e",
          "quote_formats": [
            "snp_report"
          ],
          "measurement": {
            "kind": "launch_digest",
            "launch_digest": "d400767d2d64ae14e81e3861995c394c8d2909dd261e32122d39cb010921114d",
            "image_digest": "fdc5250b913498736992024fdefa6c5e5d23a98193df216671cd26ce8d371a0d"
          },
          "notes": "0.12.8 attested-mtls 69d7281 with transitional green IMAGE_DIGEST fdc5250b.",
          "golden_version": "openapi-golden-20260729-853aefc5f849-seal-sync-app-0.12.8"
        },
        {
          "build_version": "0.12.5",
          "code_hash": "ab94656e786c0475867b6850b9840fda53d52dd6d62375d451b8eb5353349e29",
          "policy_hash": "7c14218c6abcb3ec5dc1998a1e0ddb0e86c7f96d35a215e29538dc3f273f4c0e",
          "quote_formats": [
            "snp_report"
          ],
          "measurement": {
            "kind": "launch_digest",
            "launch_digest": "67f93877aaf63f2345b5cc11c535ce22a9f9a2a5c551968a5c1bed2829f100db",
            "image_digest": "3d520d848a0d6d76ae9bec571bc075f894318bc249c3f1083666ab279b97b8cb"
          },
          "notes": "0.12.5 RB-54 closure with release-pinned ceremony helpers; OS 853aefc + app-verity R=996091e6. Seal_sync blue/green.",
          "golden_version": "openapi-golden-20260729-853aefc5f849-seal-sync-app-0.12.5"
        },
        {
          "build_version": "0.12.5",
          "code_hash": "ab94656e786c0475867b6850b9840fda53d52dd6d62375d451b8eb5353349e29",
          "policy_hash": "7c14218c6abcb3ec5dc1998a1e0ddb0e86c7f96d35a215e29538dc3f273f4c0e",
          "quote_formats": [
            "snp_report"
          ],
          "measurement": {
            "kind": "launch_digest",
            "launch_digest": "67f93877aaf63f2345b5cc11c535ce22a9f9a2a5c551968a5c1bed2829f100db",
            "image_digest": "fdc5250b913498736992024fdefa6c5e5d23a98193df216671cd26ce8d371a0d"
          },
          "notes": "0.12.5 RB-54 closure with release-pinned helpers and transitional green IMAGE_DIGEST fdc5250b.",
          "golden_version": "openapi-golden-20260729-853aefc5f849-seal-sync-app-0.12.5"
        },
        {
          "build_version": "0.12.3",
          "code_hash": "27923ecf5c2572f55f268db55f5ba0674647b81220e4010c757e62f6bf22f22d",
          "policy_hash": "7c14218c6abcb3ec5dc1998a1e0ddb0e86c7f96d35a215e29538dc3f273f4c0e",
          "quote_formats": [
            "snp_report"
          ],
          "measurement": {
            "kind": "launch_digest",
            "launch_digest": "06d004b042892104d6d332c2f5aa630ef08f2f3bede63e70b63e9bfb2fbff355",
            "image_digest": "3d520d848a0d6d76ae9bec571bc075f894318bc249c3f1083666ab279b97b8cb"
          },
          "notes": "0.12.3 RB-54 seal-sync v3 closure; OS 853aefc + app-verity R=9f5cf1a2. Seal_sync blue/green.",
          "golden_version": "openapi-golden-20260729-853aefc5f849-seal-sync-app-0.12.3"
        },
        {
          "build_version": "0.12.3",
          "code_hash": "27923ecf5c2572f55f268db55f5ba0674647b81220e4010c757e62f6bf22f22d",
          "policy_hash": "7c14218c6abcb3ec5dc1998a1e0ddb0e86c7f96d35a215e29538dc3f273f4c0e",
          "quote_formats": [
            "snp_report"
          ],
          "measurement": {
            "kind": "launch_digest",
            "launch_digest": "06d004b042892104d6d332c2f5aa630ef08f2f3bede63e70b63e9bfb2fbff355",
            "image_digest": "fdc5250b913498736992024fdefa6c5e5d23a98193df216671cd26ce8d371a0d"
          },
          "notes": "0.12.3 RB-54 seal-sync v3 closure with transitional green IMAGE_DIGEST fdc5250b.",